{
  "schema": "schemas/normalized-findings.schema.json",
  "schema_version": "1.0",
  "generated_at": "2026-08-03T03:27:45.580898+00:00",
  "sources": [
    {
      "path": "security-results/bandit-baseline.json",
      "tool": "bandit",
      "records_read": 21,
      "duplicates_ignored": 0
    },
    {
      "path": "security-results/zap-baseline-local.json",
      "tool": "zap",
      "records_read": 6,
      "duplicates_ignored": 0
    }
  ],
  "summary": {
    "total": 27,
    "by_tool": {
      "bandit": 21,
      "zap": 6
    },
    "by_severity": {
      "medium": 2,
      "low": 21,
      "informational": 4
    }
  },
  "findings": [
    {
      "id": "bandit-c38035a2a6e76870",
      "tool": "bandit",
      "severity": "medium",
      "file_or_url": "scripts/run_all_tests.py",
      "title": "B310: Audit url open for permitted schemes. Allowing use of file:/ or custom schemes is often unexpected.",
      "description": "Audit url open for permitted schemes. Allowing use of file:/ or custom schemes is often unexpected.",
      "rule_id": "B310",
      "source_file": "security-results/bandit-baseline.json",
      "tool_version": null,
      "confidence": "high",
      "cwe": "CWE-22",
      "line": 43,
      "method": null,
      "remediation": "Review the flagged code in context and follow the Bandit rule guidance.",
      "references": [
        "https://bandit.readthedocs.io/en/1.9.4/blacklists/blacklist_calls.html#b310-urllib-urlopen",
        "https://cwe.mitre.org/data/definitions/22.html"
      ],
      "evidence": "42         try:\n43             with urlopen(\"http://localhost:8080/health\", timeout=2) as response:\n44                 if response.status == 200:",
      "metadata": {
        "test_name": "blacklist",
        "line_range": [
          43
        ],
        "column": 17,
        "end_column": 67
      }
    },
    {
      "id": "bandit-4f8d23dbe29b8c35",
      "tool": "bandit",
      "severity": "medium",
      "file_or_url": "scripts/verify_gateway.py",
      "title": "B310: Audit url open for permitted schemes. Allowing use of file:/ or custom schemes is often unexpected.",
      "description": "Audit url open for permitted schemes. Allowing use of file:/ or custom schemes is often unexpected.",
      "rule_id": "B310",
      "source_file": "security-results/bandit-baseline.json",
      "tool_version": null,
      "confidence": "high",
      "cwe": "CWE-22",
      "line": 50,
      "method": null,
      "remediation": "Review the flagged code in context and follow the Bandit rule guidance.",
      "references": [
        "https://bandit.readthedocs.io/en/1.9.4/blacklists/blacklist_calls.html#b310-urllib-urlopen",
        "https://cwe.mitre.org/data/definitions/22.html"
      ],
      "evidence": "49     try:\n50         response = urlopen(request, timeout=REQUEST_TIMEOUT_SECONDS)\n51     except HTTPError as error:",
      "metadata": {
        "test_name": "blacklist",
        "line_range": [
          50
        ],
        "column": 19,
        "end_column": 68
      }
    },
    {
      "id": "bandit-13d810debf871aef",
      "tool": "bandit",
      "severity": "low",
      "file_or_url": "scripts/run_all_tests.py",
      "title": "B404: Consider possible security implications associated with the subprocess module.",
      "description": "Consider possible security implications associated with the subprocess module.",
      "rule_id": "B404",
      "source_file": "security-results/bandit-baseline.json",
      "tool_version": null,
      "confidence": "high",
      "cwe": "CWE-78",
      "line": 6,
      "method": null,
      "remediation": "Review the flagged code in context and follow the Bandit rule guidance.",
      "references": [
        "https://bandit.readthedocs.io/en/1.9.4/blacklists/blacklist_imports.html#b404-import-subprocess",
        "https://cwe.mitre.org/data/definitions/78.html"
      ],
      "evidence": "5 import secrets\n6 import subprocess\n7 import sys",
      "metadata": {
        "test_name": "blacklist",
        "line_range": [
          6
        ],
        "column": 0,
        "end_column": 17
      }
    },
    {
      "id": "bandit-e747c28aecfc3a84",
      "tool": "bandit",
      "severity": "low",
      "file_or_url": "scripts/run_all_tests.py",
      "title": "B603: subprocess call - check for execution of untrusted input.",
      "description": "subprocess call - check for execution of untrusted input.",
      "rule_id": "B603",
      "source_file": "security-results/bandit-baseline.json",
      "tool_version": null,
      "confidence": "high",
      "cwe": "CWE-78",
      "line": 30,
      "method": null,
      "remediation": "Review the flagged code in context and follow the Bandit rule guidance.",
      "references": [
        "https://bandit.readthedocs.io/en/1.9.4/plugins/b603_subprocess_without_shell_equals_true.html",
        "https://cwe.mitre.org/data/definitions/78.html"
      ],
      "evidence": "29 ) -> subprocess.CompletedProcess[str]:\n30     return subprocess.run(\n31         arguments,\n32         cwd=ROOT,\n33         env=environment,\n34         check=check,\n35         text=True,\n36     )\n37",
      "metadata": {
        "test_name": "subprocess_without_shell_equals_true",
        "line_range": [
          30,
          31,
          32,
          33,
          34,
          35,
          36
        ],
        "column": 11,
        "end_column": 5
      }
    },
    {
      "id": "bandit-8fd51f63bd30a525",
      "tool": "bandit",
      "severity": "low",
      "file_or_url": "scripts/run_security_scan.py",
      "title": "B404: Consider possible security implications associated with the subprocess module.",
      "description": "Consider possible security implications associated with the subprocess module.",
      "rule_id": "B404",
      "source_file": "security-results/bandit-baseline.json",
      "tool_version": null,
      "confidence": "high",
      "cwe": "CWE-78",
      "line": 5,
      "method": null,
      "remediation": "Review the flagged code in context and follow the Bandit rule guidance.",
      "references": [
        "https://bandit.readthedocs.io/en/1.9.4/blacklists/blacklist_imports.html#b404-import-subprocess",
        "https://cwe.mitre.org/data/definitions/78.html"
      ],
      "evidence": "4 from pathlib import Path\n5 import subprocess\n6 import sys",
      "metadata": {
        "test_name": "blacklist",
        "line_range": [
          5
        ],
        "column": 0,
        "end_column": 17
      }
    },
    {
      "id": "bandit-6798f39c8e7eb35a",
      "tool": "bandit",
      "severity": "low",
      "file_or_url": "scripts/run_security_scan.py",
      "title": "B603: subprocess call - check for execution of untrusted input.",
      "description": "subprocess call - check for execution of untrusted input.",
      "rule_id": "B603",
      "source_file": "security-results/bandit-baseline.json",
      "tool_version": null,
      "confidence": "high",
      "cwe": "CWE-78",
      "line": 44,
      "method": null,
      "remediation": "Review the flagged code in context and follow the Bandit rule guidance.",
      "references": [
        "https://bandit.readthedocs.io/en/1.9.4/plugins/b603_subprocess_without_shell_equals_true.html",
        "https://cwe.mitre.org/data/definitions/78.html"
      ],
      "evidence": "43     ]\n44     result = subprocess.run(command, cwd=ROOT, check=False)\n45     if output_path.is_file():",
      "metadata": {
        "test_name": "subprocess_without_shell_equals_true",
        "line_range": [
          44
        ],
        "column": 13,
        "end_column": 59
      }
    },
    {
      "id": "bandit-16cd47a8144e44ac",
      "tool": "bandit",
      "severity": "low",
      "file_or_url": "scripts/verify_gateway.py",
      "title": "B105: Possible hardcoded password: 'http://localhost:8081/realms/staging/protocol/openid-connect/token'",
      "description": "Possible hardcoded password: 'http://localhost:8081/realms/staging/protocol/openid-connect/token'",
      "rule_id": "B105",
      "source_file": "security-results/bandit-baseline.json",
      "tool_version": null,
      "confidence": "medium",
      "cwe": "CWE-259",
      "line": 16,
      "method": null,
      "remediation": "Review the flagged code in context and follow the Bandit rule guidance.",
      "references": [
        "https://bandit.readthedocs.io/en/1.9.4/plugins/b105_hardcoded_password_string.html",
        "https://cwe.mitre.org/data/definitions/259.html"
      ],
      "evidence": "15 BACKEND_URL = \"http://localhost:8000\"\n16 TOKEN_URL = \"http://localhost:8081/realms/staging/protocol/openid-connect/token\"\n17 REQUEST_TIMEOUT_SECONDS = 3",
      "metadata": {
        "test_name": "hardcoded_password_string",
        "line_range": [
          16
        ],
        "column": 12,
        "end_column": 80
      }
    },
    {
      "id": "bandit-8496bdfdf26647f3",
      "tool": "bandit",
      "severity": "low",
      "file_or_url": "scripts/verify_gateway.py",
      "title": "B101: Use of assert detected. The enclosed code will be removed when compiling to optimised byte code.",
      "description": "Use of assert detected. The enclosed code will be removed when compiling to optimised byte code.",
      "rule_id": "B101",
      "source_file": "security-results/bandit-baseline.json",
      "tool_version": null,
      "confidence": "high",
      "cwe": "CWE-703",
      "line": 91,
      "method": null,
      "remediation": "Review the flagged code in context and follow the Bandit rule guidance.",
      "references": [
        "https://bandit.readthedocs.io/en/1.9.4/plugins/b101_assert_used.html",
        "https://cwe.mitre.org/data/definitions/703.html"
      ],
      "evidence": "90     )\n91     assert status == 200, f\"Token request for {client_id} failed with HTTP {status}\"\n92     assert isinstance(body, dict) and isinstance(body.get(\"access_token\"), str)",
      "metadata": {